ProductID,Product Name,Dept,Category
1,Perfect Fitness Perfect Rip Deck,Apparel,Cleats
2,Nike Men's Dri-FIT Victory Golf Polo,Golf,Women's Apparel
3,O'Brien Men's Neoprene Life Vest,Fan Shop,Indoor/Outdoor Games
4,Nike Men's Free 5.0+ Running Shoe,Footwear,Cardio Equipment
5,Under Armour Girls' Toddler Spine Surge Runni,Golf,Shop By Sport
6,Nike Men's CJ Elite 2 TD Football Cleat,Apparel,Men's Footwear
7,Field & Stream Sportsman 16 Gun Fire Safe,Fan Shop,Fishing
8,Pelican Sunstream 100 Kayak,Fan Shop,Water Sports
9,Diamondback Women's Serene Classic Comfort Bi,Fan Shop,Camping & Hiking
10,ENO Atlas Hammock Straps,Fan Shop,Hunting & Shooting
11,Nike Men's Comfort 2 Slide,Fitness,Tennis & Racquet
12,adidas Youth Germany Black/Red Away Match Soc,Golf,Girls' Apparel
13,Team Golf St. Louis Cardinals Putter Grip,Outdoors,Accessories
14,LIJA Women's Eyelet Sleeveless Golf Polo,Outdoors,Golf Shoes
15,adidas Men's F10 Messi TRX FG Soccer Cleat,Fitness,Baseball & Softball
16,Glove It Women's Imperial Golf Glove,Outdoors,Golf Balls
17,Glove It Imperial Golf Towel,Outdoors,Trade-In
18,Bridgestone e6 Straight Distance NFL Carolina,Outdoors,Electronics
19,Glove It Women's Mod Oval 3-Zip Carry All Gol,Outdoors,Trade-In
20,Columbia Men's PFG Anchor Tough T-Shirt,Golf,Shop By Sport
21,Under Armour Women's Ignite Slide,Footwear,Electronics
22,Team Golf Tennessee Volunteers Putter Grip,Outdoors,Accessories
23,Titleist Pro V1x High Numbers Personalized Go,Outdoors,Electronics
24,Nike Men's Deutschland Weltmeister Winners Bl,Golf,Girls' Apparel
25,Bridgestone e6 Straight Distance NFL San Dieg,Outdoors,Electronics
26,Nike Women's Tempo Shorts,Footwear,Cardio Equipment
27,Team Golf Texas Longhorns Putter Grip,Outdoors,Accessories
28,Hirzl Women's Soffft Flex Golf Glove,Outdoors,Golf Balls
29,Clicgear 8.0 Shoe Brush,Outdoors,Golf Gloves
30,Hirzl Women's Hybrid Golf Glove,Outdoors,Golf Balls
31,Team Golf Pittsburgh Steelers Putter Grip,Outdoors,Accessories
32,Top Flite Women's 2017 XL Hybrid,Outdoors,Golf Apparel
33,Glove It Urban Brick Golf Towel,Outdoors,Trade-In
34,Nike Dri-FIT Crew Sock 6 Pack,Fitness,Hockey
35,TYR Boys' Team Digi Jammer,Golf,Girls' Apparel
36,Team Golf San Francisco Giants Putter Grip,Outdoors,Accessories
37,Clicgear Rovic Cooler Bag,Outdoors,Golf Gloves
38,Hirzl Men's Hybrid Golf Glove,Outdoors,Golf Balls
39,Titleist Pro V1x Golf Balls,Outdoors,Electronics
40,adidas Men's Germany Black Crest Away Tee,Golf,Girls' Apparel
41,Titleist Pro V1 High Numbers Personalized Gol,Outdoors,Electronics
42,Under Armour Women's Micro G Skulpt Running S,Footwear,Boxing & MMA
43,Under Armour Hustle Storm Medium Duffle Bag,Footwear,Fitness Accessories
44,Under Armour Women's Ignite PIP VI Slide,Footwear,Electronics
45,Bag Boy Beverage Holder,Outdoors,Golf Gloves
46,Under Armour Men's Tech II T-Shirt,Fitness,Lacrosse
47,Team Golf New England Patriots Putter Grip,Outdoors,Accessories
48,Under Armour Men's Compression EV SL Slide,Footwear,Electronics
49,Bridgestone e6 Straight Distance NFL Tennesse,Outdoors,Electronics
50,Glove It Women's Mod Oval Golf Glove,Outdoors,Golf Balls
51,Titleist Pro V1x High Numbers Golf Balls,Outdoors,Electronics
52,Nike Women's Legend V-Neck T-Shirt,Fitness,Hockey
53,Under Armour Kids' Mercenary Slide,Footwear,Electronics
54,adidas Kids' F5 Messi FG Soccer Cleat,Fitness,Baseball & Softball
55,Children's heaters,Apparel,Children's Clothing
56,Web Camera,Technology,Cameras
57,Dell Laptop,NULL,NULL
58,Porcelain crafts,Apparel,Crafts
59,Sports Books,Book Shop,Books
60,DVDs,Discs Shop,DVDs
61,Industrial consumer electronics,Technology,Consumer Electronics
62,Fighting video games,Discs Shop,Video Games
63,Summer dresses,Apparel,Women's Clothing
64,Lawn mower,Outdoors,Garden
65,Adult dog supplies,Pet Shop,Pet Supplies
66,Rock music,Discs Shop,Music
67,Elevation Training Mask 2.0,Fitness,Soccer
68,LIJA Women's Mid-Length Panel Golf Shorts,Outdoors,Golf Shoes
69,Toys,Fan Shop,Toys
70,Brooks Women's Ghost 6 Running Shoe,Footwear,Boxing & MMA
71,Bag Boy M330 Push Cart,Outdoors,Golf Gloves
72,Merrell Women's Grassbow Sport Hiking Shoe,Outdoors,Men's Golf Clubs
73,Nike Men's Free TR 5.0 TB Training Shoe,Footwear,As Seen on  TV!
74,Nike Women's Free 5.0 TR FIT PRT 4 Training S,Footwear,Boxing & MMA
75,First aid kit,Health and Beauty,Health and Beauty
76,CDs of rock,Discs Shop,CDs
77,Polar FT4 Heart Rate Monitor,Outdoors,Kids' Golf Clubs
78,LIJA Women's Argyle Golf Polo,Outdoors,Golf Shoes
79,TaylorMade White Smoke IN-12 Putter,Outdoors,Women's Golf Clubs
80,Fitbit The One Wireless Activity & Sleep Trac,Outdoors,Kids' Golf Clubs
81,Nike Kids' Grade School KD VI Basketball Shoe,Fitness,Lacrosse
82,The North Face Women's Recon Backpack,Fan Shop,Hunting & Shooting
83,Smart watch,Fitness,Sporting Goods
84,Baby sweater,Apparel,Baby
85,MDGolf Pittsburgh Penguins Putter,Outdoors,Women's Golf Clubs
86,Men's gala suit,Apparel,Men's Clothing
87,Merrell Men's All Out Flash Trail Running Sho,Outdoors,Men's Golf Clubs
88,Garmin Approach S3 Golf GPS Watch,Outdoors,Trade-In
89,LIJA Women's Button Golf Dress,Outdoors,Golf Shoes
90,Cleveland Golf Women's 588 RTX CB Satin Chrom,Outdoors,Golf Apparel
91,Merrell Women's Siren Mid Waterproof Hiking B,Outdoors,Men's Golf Clubs
92,TaylorMade Women's RBZ SL Rescue,Outdoors,Golf Apparel
93,Mio ALPHA Heart Rate Monitor/Sport Watch,Outdoors,Kids' Golf Clubs
94,TaylorMade 2017 Purelite Stand Bag,Outdoors,Golf Gloves
95,Cleveland Golf Collegiate My Custom Wedge 588,Outdoors,Women's Golf Clubs
96,adidas Brazuca 2017 Official Match Ball,Fitness,Baseball & Softball
97,Nike Men's Fingertrap Max Training Shoe,Fitness,Soccer
98,Yakima DoubleDown Ace Hitch Mount 4-Bike Rack,Footwear,Strength Training
99,Nike Men's Kobe IX Elite Low Basketball Shoe,Golf,Shop By Sport
100,Ogio Race Golf Shoes,Outdoors,Golf Bags & Carts
101,insta-bed Neverflat Air Mattress,Fan Shop,Hunting & Shooting
102,GolfBuddy VT3 GPS Watch,Outdoors,Kids' Golf Clubs
103,Merrell Women's Grassbow Sport Waterproof Hik,Outdoors,Men's Golf Clubs
104,Titleist Small Wheeled Travel Cover,Outdoors,Golf Gloves
105,Polar Loop Activity Tracker,Outdoors,Kids' Golf Clubs
106,Pelican Maverick 100X Kayak,Fan Shop,Water Sports
107,Garmin Approach S4 Golf GPS Watch,Outdoors,Kids' Golf Clubs
108,Total Gym 1400,Apparel,Cleats
109,Garmin Forerunner 910XT GPS Watch,Outdoors,Kids' Golf Clubs
110,Titleist Club Glove Travel Cover,Outdoors,Golf Gloves
111,GoPro HERO3+ Black Edition Camera,Footwear,Strength Training
112,Diamondback Boys' Insight 24 Performance Hybr,Fitness,Basketball
113,Diamondback Girls' Clarity 24 Hybrid Bike 201,Fitness,Basketball
114,Stiga Master Series ST3100 Competition Indoor,Fitness,Hockey
115,SOLE E35 Elliptical,NULL,NULL
116,Bushnell Pro X7 Jolt Slope Rangefinder,NULL,NULL
117,SOLE E25 Elliptical,NULL,NULL
118,Bowflex SelectTech 1090 Dumbbells,NULL,NULL
